{
  "competition_id": "18599",
  "generated_at": "2025-08-17T14:55:15.133367",
  "analysis_sections": {
    "overall_summary": "The clustering analysis of 518 Kaggle notebook workflows reveals distinct patterns with a strong emphasis on data transformation and visualization, as evidenced by the high frequency of transitions within these states. Notably, clusters such as Cluster 33 and Cluster 37, which heavily feature data transformation, suggest a focus on iterative data refinement. Clusters like Cluster 9 and Cluster 23 emphasize visualization, indicating a trend towards exploratory data analysis. The diversity in cluster sizes and types, from minimalistic environments to complex data transformation workflows, highlights varied approaches to notebook development, catering to different stages of the machine learning lifecycle.",
    "cluster_titles": {
      "raw_text": "- Cluster 1: The Exporter\n- Cluster 2: Minimalist Setup\n- Cluster 3: Evaluation Focus\n- Cluster 4: Visual Storyteller\n- Cluster 5: Extraction Enthusiast\n- Cluster 6: Transformative Trainer\n- Cluster 7: Training Specialist\n- Cluster 8: Visual Analyzer\n- Cluster 9: Visualization Centric\n- Cluster 10: Transformative Visualizer\n- Cluster 11: Data Insight Seeker\n- Cluster 12: Evaluative Visualizer\n- Cluster 13: Feature Transformer\n- Cluster 14: Training Visualizer\n- Cluster 15: Transformative Explorer\n- Cluster 16: Feature Engineer\n- Cluster 17: EDA Transformer\n- Cluster 18: Transformative Specialist\n- Cluster 19: Data Transformer\n- Cluster 20: Hyperparameter Tuner\n- Cluster 21: Extraction Expert\n- Cluster 22: Commented Setup\n- Cluster 23: Visual Data Explorer\n- Cluster 24: Transformative Developer\n- Cluster 25: Extraction Driven\n- Cluster 26: Iterative Trainer\n- Cluster 27: Transformative Visualizer\n- Cluster 28: Visual Transformer\n- Cluster 29: Visualization Specialist\n- Cluster 30: Insightful Transformer\n- Cluster 31: Evaluative Explorer\n- Cluster 32: Visual Commentator\n- Cluster 33: Comprehensive Transformer\n- Cluster 34: Feature Focused Transformer\n- Cluster 35: Data Transformation Enthusiast\n- Cluster 36: Extensive Transformer\n- Cluster 37: Iterative Modeler",
      "structured": {
        "1": "The Exporter",
        "2": "Minimalist Setup",
        "3": "Evaluation Focus",
        "4": "Visual Storyteller",
        "5": "Extraction Enthusiast",
        "6": "Transformative Trainer",
        "7": "Training Specialist",
        "8": "Visual Analyzer",
        "9": "Visualization Centric",
        "10": "Transformative Visualizer",
        "11": "Data Insight Seeker",
        "12": "Evaluative Visualizer",
        "13": "Feature Transformer",
        "14": "Training Visualizer",
        "15": "Transformative Explorer",
        "16": "Feature Engineer",
        "17": "EDA Transformer",
        "18": "Transformative Specialist",
        "19": "Data Transformer",
        "20": "Hyperparameter Tuner",
        "21": "Extraction Expert",
        "22": "Commented Setup",
        "23": "Visual Data Explorer",
        "24": "Transformative Developer",
        "25": "Extraction Driven",
        "26": "Iterative Trainer",
        "27": "Transformative Visualizer",
        "28": "Visual Transformer",
        "29": "Visualization Specialist",
        "30": "Insightful Transformer",
        "31": "Evaluative Explorer",
        "32": "Visual Commentator",
        "33": "Comprehensive Transformer",
        "34": "Feature Focused Transformer",
        "35": "Data Transformation Enthusiast",
        "36": "Extensive Transformer",
        "37": "Iterative Modeler"
      }
    },
    "individual_summaries": {
      "raw_text": "- Cluster 1: Focused on exporting results after feature engineering, this workflow is ideal for finalizing and sharing outputs.\n- Cluster 2: Represents a minimalistic setup with only environment configurations, suitable for quick prototyping.\n- Cluster 3: Primarily environment-focused with a final evaluation step, indicating a setup for model assessment.\n- Cluster 4: Dominated by visualization, this cluster is geared towards in-depth data exploration and presentation.\n- Cluster 5: Heavy on data extraction, this pattern is suited for data acquisition and initial preprocessing.\n- Cluster 6: Combines data transformation with model training, highlighting a focus on data preparation for modeling.\n- Cluster 7: Emphasizes model training with subsequent data export, ideal for iterative model development.\n- Cluster 8: Balances data transformation and visualization, facilitating exploratory data analysis.\n- Cluster 9: Predominantly visualization-focused, this cluster supports extensive data exploration.\n- Cluster 10: Integrates data transformation with visualization, suitable for iterative data analysis.\n- Cluster 11: Combines data extraction with visualization, emphasizing data-driven insights.\n- Cluster 12: Blends visualization with model evaluation, focusing on visual model assessment.\n- Cluster 13: Centers on data transformation and feature engineering, ideal for feature-rich model preparation.\n- Cluster 14: Mixes model training with visualization, supporting visual model diagnostics.\n- Cluster 15: Focuses on extensive data transformation, suitable for thorough data cleaning.\n- Cluster 16: Emphasizes feature engineering, supporting advanced feature development.\n- Cluster 17: Combines data transformation with EDA, ideal for exploratory data preparation.\n- Cluster 18: Dedicated to data transformation, highlighting extensive data manipulation.\n- Cluster 19: Focuses on repetitive data transformation, suitable for consistent data refinement.\n- Cluster 20: Integrates hyperparameter tuning with data transformation, supporting model optimization.\n- Cluster 21: Heavy on data extraction, this pattern is ideal for data gathering and initial analysis.\n- Cluster 22: Minimalist environment setup with comments, suitable for annotated code snippets.\n- Cluster 23: Emphasizes visualization, supporting detailed data exploration.\n- Cluster 24: Centers on data transformation, highlighting iterative data refinement.\n- Cluster 25: Focused on data extraction, ideal for data-centric projects.\n- Cluster 26: Iterative model training with comments, suitable for collaborative model development.\n- Cluster 27: Balances data transformation and visualization, supporting comprehensive data analysis.\n- Cluster 28: Integrates visualization with data transformation, ideal for visual data exploration.\n- Cluster 29: Focused on visualization, supporting detailed data presentation.\n- Cluster 30: Combines data transformation with visualization, ideal for insightful data analysis.\n- Cluster 31: Mixes model evaluation with visualization, supporting evaluative data exploration.\n- Cluster 32: Blends visualization with comments, suitable for annotated visual analysis.\n- Cluster 33: Comprehensive data transformation with visualization, supporting extensive data exploration.\n- Cluster 34: Emphasizes feature engineering and transformation, ideal for feature-rich model development.\n- Cluster 35: Focused on data transformation, supporting thorough data preparation.\n- Cluster 36: Extensive data transformation, ideal for large-scale data manipulation.\n- Cluster 37: Iterative model training with transformation, supporting iterative model refinement.",
      "structured": {
        "1": "Focused on exporting results after feature engineering, this workflow is ideal for finalizing and sharing outputs.",
        "2": "Represents a minimalistic setup with only environment configurations, suitable for quick prototyping.",
        "3": "Primarily environment-focused with a final evaluation step, indicating a setup for model assessment.",
        "4": "Dominated by visualization, this cluster is geared towards in-depth data exploration and presentation.",
        "5": "Heavy on data extraction, this pattern is suited for data acquisition and initial preprocessing.",
        "6": "Combines data transformation with model training, highlighting a focus on data preparation for modeling.",
        "7": "Emphasizes model training with subsequent data export, ideal for iterative model development.",
        "8": "Balances data transformation and visualization, facilitating exploratory data analysis.",
        "9": "Predominantly visualization-focused, this cluster supports extensive data exploration.",
        "10": "Integrates data transformation with visualization, suitable for iterative data analysis.",
        "11": "Combines data extraction with visualization, emphasizing data-driven insights.",
        "12": "Blends visualization with model evaluation, focusing on visual model assessment.",
        "13": "Centers on data transformation and feature engineering, ideal for feature-rich model preparation.",
        "14": "Mixes model training with visualization, supporting visual model diagnostics.",
        "15": "Focuses on extensive data transformation, suitable for thorough data cleaning.",
        "16": "Emphasizes feature engineering, supporting advanced feature development.",
        "17": "Combines data transformation with EDA, ideal for exploratory data preparation.",
        "18": "Dedicated to data transformation, highlighting extensive data manipulation.",
        "19": "Focuses on repetitive data transformation, suitable for consistent data refinement.",
        "20": "Integrates hyperparameter tuning with data transformation, supporting model optimization.",
        "21": "Heavy on data extraction, this pattern is ideal for data gathering and initial analysis.",
        "22": "Minimalist environment setup with comments, suitable for annotated code snippets.",
        "23": "Emphasizes visualization, supporting detailed data exploration.",
        "24": "Centers on data transformation, highlighting iterative data refinement.",
        "25": "Focused on data extraction, ideal for data-centric projects.",
        "26": "Iterative model training with comments, suitable for collaborative model development.",
        "27": "Balances data transformation and visualization, supporting comprehensive data analysis.",
        "28": "Integrates visualization with data transformation, ideal for visual data exploration.",
        "29": "Focused on visualization, supporting detailed data presentation.",
        "30": "Combines data transformation with visualization, ideal for insightful data analysis.",
        "31": "Mixes model evaluation with visualization, supporting evaluative data exploration.",
        "32": "Blends visualization with comments, suitable for annotated visual analysis.",
        "33": "Comprehensive data transformation with visualization, supporting extensive data exploration.",
        "34": "Emphasizes feature engineering and transformation, ideal for feature-rich model development.",
        "35": "Focused on data transformation, supporting thorough data preparation.",
        "36": "Extensive data transformation, ideal for large-scale data manipulation.",
        "37": "Iterative model training with transformation, supporting iterative model refinement."
      }
    }
  },
  "gpt_analysis_full": "## Overall Summary\nThe clustering analysis of 518 Kaggle notebook workflows reveals distinct patterns with a strong emphasis on data transformation and visualization, as evidenced by the high frequency of transitions within these states. Notably, clusters such as Cluster 33 and Cluster 37, which heavily feature data transformation, suggest a focus on iterative data refinement. Clusters like Cluster 9 and Cluster 23 emphasize visualization, indicating a trend towards exploratory data analysis. The diversity in cluster sizes and types, from minimalistic environments to complex data transformation workflows, highlights varied approaches to notebook development, catering to different stages of the machine learning lifecycle.\n\n## Cluster Titles\n- Cluster 1: The Exporter\n- Cluster 2: Minimalist Setup\n- Cluster 3: Evaluation Focus\n- Cluster 4: Visual Storyteller\n- Cluster 5: Extraction Enthusiast\n- Cluster 6: Transformative Trainer\n- Cluster 7: Training Specialist\n- Cluster 8: Visual Analyzer\n- Cluster 9: Visualization Centric\n- Cluster 10: Transformative Visualizer\n- Cluster 11: Data Insight Seeker\n- Cluster 12: Evaluative Visualizer\n- Cluster 13: Feature Transformer\n- Cluster 14: Training Visualizer\n- Cluster 15: Transformative Explorer\n- Cluster 16: Feature Engineer\n- Cluster 17: EDA Transformer\n- Cluster 18: Transformative Specialist\n- Cluster 19: Data Transformer\n- Cluster 20: Hyperparameter Tuner\n- Cluster 21: Extraction Expert\n- Cluster 22: Commented Setup\n- Cluster 23: Visual Data Explorer\n- Cluster 24: Transformative Developer\n- Cluster 25: Extraction Driven\n- Cluster 26: Iterative Trainer\n- Cluster 27: Transformative Visualizer\n- Cluster 28: Visual Transformer\n- Cluster 29: Visualization Specialist\n- Cluster 30: Insightful Transformer\n- Cluster 31: Evaluative Explorer\n- Cluster 32: Visual Commentator\n- Cluster 33: Comprehensive Transformer\n- Cluster 34: Feature Focused Transformer\n- Cluster 35: Data Transformation Enthusiast\n- Cluster 36: Extensive Transformer\n- Cluster 37: Iterative Modeler\n\n## Individual Cluster Summaries\n- Cluster 1: Focused on exporting results after feature engineering, this workflow is ideal for finalizing and sharing outputs.\n- Cluster 2: Represents a minimalistic setup with only environment configurations, suitable for quick prototyping.\n- Cluster 3: Primarily environment-focused with a final evaluation step, indicating a setup for model assessment.\n- Cluster 4: Dominated by visualization, this cluster is geared towards in-depth data exploration and presentation.\n- Cluster 5: Heavy on data extraction, this pattern is suited for data acquisition and initial preprocessing.\n- Cluster 6: Combines data transformation with model training, highlighting a focus on data preparation for modeling.\n- Cluster 7: Emphasizes model training with subsequent data export, ideal for iterative model development.\n- Cluster 8: Balances data transformation and visualization, facilitating exploratory data analysis.\n- Cluster 9: Predominantly visualization-focused, this cluster supports extensive data exploration.\n- Cluster 10: Integrates data transformation with visualization, suitable for iterative data analysis.\n- Cluster 11: Combines data extraction with visualization, emphasizing data-driven insights.\n- Cluster 12: Blends visualization with model evaluation, focusing on visual model assessment.\n- Cluster 13: Centers on data transformation and feature engineering, ideal for feature-rich model preparation.\n- Cluster 14: Mixes model training with visualization, supporting visual model diagnostics.\n- Cluster 15: Focuses on extensive data transformation, suitable for thorough data cleaning.\n- Cluster 16: Emphasizes feature engineering, supporting advanced feature development.\n- Cluster 17: Combines data transformation with EDA, ideal for exploratory data preparation.\n- Cluster 18: Dedicated to data transformation, highlighting extensive data manipulation.\n- Cluster 19: Focuses on repetitive data transformation, suitable for consistent data refinement.\n- Cluster 20: Integrates hyperparameter tuning with data transformation, supporting model optimization.\n- Cluster 21: Heavy on data extraction, this pattern is ideal for data gathering and initial analysis.\n- Cluster 22: Minimalist environment setup with comments, suitable for annotated code snippets.\n- Cluster 23: Emphasizes visualization, supporting detailed data exploration.\n- Cluster 24: Centers on data transformation, highlighting iterative data refinement.\n- Cluster 25: Focused on data extraction, ideal for data-centric projects.\n- Cluster 26: Iterative model training with comments, suitable for collaborative model development.\n- Cluster 27: Balances data transformation and visualization, supporting comprehensive data analysis.\n- Cluster 28: Integrates visualization with data transformation, ideal for visual data exploration.\n- Cluster 29: Focused on visualization, supporting detailed data presentation.\n- Cluster 30: Combines data transformation with visualization, ideal for insightful data analysis.\n- Cluster 31: Mixes model evaluation with visualization, supporting evaluative data exploration.\n- Cluster 32: Blends visualization with comments, suitable for annotated visual analysis.\n- Cluster 33: Comprehensive data transformation with visualization, supporting extensive data exploration.\n- Cluster 34: Emphasizes feature engineering and transformation, ideal for feature-rich model development.\n- Cluster 35: Focused on data transformation, supporting thorough data preparation.\n- Cluster 36: Extensive data transformation, ideal for large-scale data manipulation.\n- Cluster 37: Iterative model training with transformation, supporting iterative model refinement."
}