{
  "competition_id": "35332",
  "generated_at": "2025-08-17T14:56:24.972978",
  "analysis_sections": {
    "overall_summary": "The clustering analysis of 601 Kaggle notebook workflows revealed 36 distinct patterns, with a strong emphasis on data transformation, as evidenced by the high frequency of the \"Data_Transform â†’ Data_Transform\" transition (14.2%). Notably, clusters vary significantly in focus, from data transformation-heavy workflows to those prioritizing visualization or model training. The largest cluster, Cluster 21, highlights an iterative data extraction and transformation process, while smaller clusters often focus on specific tasks like model training or data export, reflecting diverse practical applications from exploratory data analysis to model refinement and deployment.",
    "cluster_titles": {
      "raw_text": "- Cluster 1: The Data Transformer\n- Cluster 2: The Commented Explorer\n- Cluster 3: Extraction-Heavy Transformer\n- Cluster 4: Visualization Enthusiast\n- Cluster 5: Transformative Insights\n- Cluster 6: Training Marathon\n- Cluster 7: Extraction Specialist\n- Cluster 8: Export-Driven Engineer\n- Cluster 9: Feature and Evaluation Loop\n- Cluster 10: Singular Trainer\n- Cluster 11: Environment Exporter\n- Cluster 12: Visual Data Explorer\n- Cluster 13: EDA and Visualization Journey\n- Cluster 14: Transformative Evaluator\n- Cluster 15: Consistent Transformer\n- Cluster 16: Commented Transformations\n- Cluster 17: Comment-Heavy Transformer\n- Cluster 18: Tuned Trainer\n- Cluster 19: Commented Training\n- Cluster 20: Extraction and Evaluation\n- Cluster 21: Iterative Transformer\n- Cluster 22: Commented Visualizer\n- Cluster 23: EDA and Visualization Explorer\n- Cluster 24: Visual Transformation\n- Cluster 25: Export-Driven Transformer\n- Cluster 26: EDA-Driven Transformer\n- Cluster 27: Commented Extractor\n- Cluster 28: Export-Heavy Engineer\n- Cluster 29: Evaluation Exporter\n- Cluster 30: Visualization Specialist\n- Cluster 31: Environment-Driven Visualizer\n- Cluster 32: Transformative Explorer\n- Cluster 33: Visual Data Transformer\n- Cluster 34: Tuned Transformation\n- Cluster 35: Extraction-Driven Workflow\n- Cluster 36: Environment-Centric Workflow",
      "structured": {
        "1": "The Data Transformer",
        "2": "The Commented Explorer",
        "3": "Extraction-Heavy Transformer",
        "4": "Visualization Enthusiast",
        "5": "Transformative Insights",
        "6": "Training Marathon",
        "7": "Extraction Specialist",
        "8": "Export-Driven Engineer",
        "9": "Feature and Evaluation Loop",
        "10": "Singular Trainer",
        "11": "Environment Exporter",
        "12": "Visual Data Explorer",
        "13": "EDA and Visualization Journey",
        "14": "Transformative Evaluator",
        "15": "Consistent Transformer",
        "16": "Commented Transformations",
        "17": "Comment-Heavy Transformer",
        "18": "Tuned Trainer",
        "19": "Commented Training",
        "20": "Extraction and Evaluation",
        "21": "Iterative Transformer",
        "22": "Commented Visualizer",
        "23": "EDA and Visualization Explorer",
        "24": "Visual Transformation",
        "25": "Export-Driven Transformer",
        "26": "EDA-Driven Transformer",
        "27": "Commented Extractor",
        "28": "Export-Heavy Engineer",
        "29": "Evaluation Exporter",
        "30": "Visualization Specialist",
        "31": "Environment-Driven Visualizer",
        "32": "Transformative Explorer",
        "33": "Visual Data Transformer",
        "34": "Tuned Transformation",
        "35": "Extraction-Driven Workflow",
        "36": "Environment-Centric Workflow"
      }
    },
    "individual_summaries": {
      "raw_text": "- Cluster 1: Focuses on extensive data transformation with a delayed data extraction phase, ideal for preprocessing-heavy tasks.\n- Cluster 2: Combines data extraction and transformation with frequent commenting, suitable for exploratory analysis with documentation.\n- Cluster 3: Emphasizes repeated data extraction followed by transformation, useful for datasets requiring multiple loading stages.\n- Cluster 4: Prioritizes visualization with intermittent data extraction, catering to users focused on visual data exploration.\n- Cluster 5: Centers on data transformation post-EDA, indicative of workflows refining insights from initial analysis.\n- Cluster 6: Dominated by model training interspersed with data transformation, fitting for iterative model development.\n- Cluster 7: Primarily involves data extraction with a final export, ideal for data collection and output tasks.\n- Cluster 8: Features a strong focus on data export following feature engineering, suitable for finalizing and sharing results.\n- Cluster 9: Alternates between feature engineering and model evaluation, reflecting a cycle of feature refinement and assessment.\n- Cluster 10: Uniquely consists of a single model training step, possibly representing a minimalistic training approach.\n- Cluster 11: Involves repeated environment setup with a final export, useful for environments requiring frequent resets.\n- Cluster 12: Combines data extraction with visualization, suitable for users needing to visualize large datasets.\n- Cluster 13: Integrates EDA and visualization, ideal for comprehensive data exploration and presentation.\n- Cluster 14: Focuses on data transformation with a concluding evaluation, suited for workflows refining models post-transformation.\n- Cluster 15: Consistently applies data transformation, indicative of workflows requiring extensive preprocessing.\n- Cluster 16: Mixes data transformation with commentary, fitting for documented data cleaning processes.\n- Cluster 17: Features commentary interspersed with transformation, useful for annotated preprocessing workflows.\n- Cluster 18: Combines feature engineering with model training and tuning, ideal for optimized model development.\n- Cluster 19: Involves model training with frequent commentary, suitable for documented training processes.\n- Cluster 20: Alternates between data extraction and model evaluation, reflecting a workflow focused on iterative data assessment.\n- Cluster 21: Shows a repetitive pattern of data extraction and transformation, useful for iterative preprocessing.\n- Cluster 22: Combines data transformation with visualization and commentary, fitting for documented visual analysis.\n- Cluster 23: Integrates EDA and visualization with transformation, ideal for exploratory data analysis and presentation.\n- Cluster 24: Emphasizes visualization with some transformation, suitable for visually-driven data insights.\n- Cluster 25: Focuses on data transformation with a final export, indicative of workflows preparing data for output.\n- Cluster 26: Combines data extraction with EDA, useful for exploratory data analysis with iterative data loading.\n- Cluster 27: Features repeated data extraction with commentary, fitting for documented data collection processes.\n- Cluster 28: Centers on data export following feature engineering, suitable for finalizing and sharing engineered datasets.\n- Cluster 29: Involves model evaluation with a concluding export, ideal for workflows focused on model assessment and results sharing.\n- Cluster 30: Prioritizes visualization, reflecting a workflow dedicated to visual data exploration.\n- Cluster 31: Combines environment setup with visualization, suitable for environments requiring frequent visual updates.\n- Cluster 32: Focuses on data transformation with EDA, indicative of exploratory data preprocessing.\n- Cluster 33: Integrates data transformation with visualization, ideal for workflows requiring visual data insights.\n- Cluster 34: Combines model training with hyperparameter tuning, fitting for optimized model development.\n- Cluster 35: Emphasizes data extraction, suitable for workflows focused on data collection and preparation.\n- Cluster 36: Features repeated environment setup, ideal for workflows requiring frequent environment resets.",
      "structured": {
        "1": "Focuses on extensive data transformation with a delayed data extraction phase, ideal for preprocessing-heavy tasks.",
        "2": "Combines data extraction and transformation with frequent commenting, suitable for exploratory analysis with documentation.",
        "3": "Emphasizes repeated data extraction followed by transformation, useful for datasets requiring multiple loading stages.",
        "4": "Prioritizes visualization with intermittent data extraction, catering to users focused on visual data exploration.",
        "5": "Centers on data transformation post-EDA, indicative of workflows refining insights from initial analysis.",
        "6": "Dominated by model training interspersed with data transformation, fitting for iterative model development.",
        "7": "Primarily involves data extraction with a final export, ideal for data collection and output tasks.",
        "8": "Features a strong focus on data export following feature engineering, suitable for finalizing and sharing results.",
        "9": "Alternates between feature engineering and model evaluation, reflecting a cycle of feature refinement and assessment.",
        "10": "Uniquely consists of a single model training step, possibly representing a minimalistic training approach.",
        "11": "Involves repeated environment setup with a final export, useful for environments requiring frequent resets.",
        "12": "Combines data extraction with visualization, suitable for users needing to visualize large datasets.",
        "13": "Integrates EDA and visualization, ideal for comprehensive data exploration and presentation.",
        "14": "Focuses on data transformation with a concluding evaluation, suited for workflows refining models post-transformation.",
        "15": "Consistently applies data transformation, indicative of workflows requiring extensive preprocessing.",
        "16": "Mixes data transformation with commentary, fitting for documented data cleaning processes.",
        "17": "Features commentary interspersed with transformation, useful for annotated preprocessing workflows.",
        "18": "Combines feature engineering with model training and tuning, ideal for optimized model development.",
        "19": "Involves model training with frequent commentary, suitable for documented training processes.",
        "20": "Alternates between data extraction and model evaluation, reflecting a workflow focused on iterative data assessment.",
        "21": "Shows a repetitive pattern of data extraction and transformation, useful for iterative preprocessing.",
        "22": "Combines data transformation with visualization and commentary, fitting for documented visual analysis.",
        "23": "Integrates EDA and visualization with transformation, ideal for exploratory data analysis and presentation.",
        "24": "Emphasizes visualization with some transformation, suitable for visually-driven data insights.",
        "25": "Focuses on data transformation with a final export, indicative of workflows preparing data for output.",
        "26": "Combines data extraction with EDA, useful for exploratory data analysis with iterative data loading.",
        "27": "Features repeated data extraction with commentary, fitting for documented data collection processes.",
        "28": "Centers on data export following feature engineering, suitable for finalizing and sharing engineered datasets.",
        "29": "Involves model evaluation with a concluding export, ideal for workflows focused on model assessment and results sharing.",
        "30": "Prioritizes visualization, reflecting a workflow dedicated to visual data exploration.",
        "31": "Combines environment setup with visualization, suitable for environments requiring frequent visual updates.",
        "32": "Focuses on data transformation with EDA, indicative of exploratory data preprocessing.",
        "33": "Integrates data transformation with visualization, ideal for workflows requiring visual data insights.",
        "34": "Combines model training with hyperparameter tuning, fitting for optimized model development.",
        "35": "Emphasizes data extraction, suitable for workflows focused on data collection and preparation.",
        "36": "Features repeated environment setup, ideal for workflows requiring frequent environment resets."
      }
    }
  },
  "gpt_analysis_full": "## Overall Summary\nThe clustering analysis of 601 Kaggle notebook workflows revealed 36 distinct patterns, with a strong emphasis on data transformation, as evidenced by the high frequency of the \"Data_Transform â†’ Data_Transform\" transition (14.2%). Notably, clusters vary significantly in focus, from data transformation-heavy workflows to those prioritizing visualization or model training. The largest cluster, Cluster 21, highlights an iterative data extraction and transformation process, while smaller clusters often focus on specific tasks like model training or data export, reflecting diverse practical applications from exploratory data analysis to model refinement and deployment.\n\n## Cluster Titles\n- Cluster 1: The Data Transformer\n- Cluster 2: The Commented Explorer\n- Cluster 3: Extraction-Heavy Transformer\n- Cluster 4: Visualization Enthusiast\n- Cluster 5: Transformative Insights\n- Cluster 6: Training Marathon\n- Cluster 7: Extraction Specialist\n- Cluster 8: Export-Driven Engineer\n- Cluster 9: Feature and Evaluation Loop\n- Cluster 10: Singular Trainer\n- Cluster 11: Environment Exporter\n- Cluster 12: Visual Data Explorer\n- Cluster 13: EDA and Visualization Journey\n- Cluster 14: Transformative Evaluator\n- Cluster 15: Consistent Transformer\n- Cluster 16: Commented Transformations\n- Cluster 17: Comment-Heavy Transformer\n- Cluster 18: Tuned Trainer\n- Cluster 19: Commented Training\n- Cluster 20: Extraction and Evaluation\n- Cluster 21: Iterative Transformer\n- Cluster 22: Commented Visualizer\n- Cluster 23: EDA and Visualization Explorer\n- Cluster 24: Visual Transformation\n- Cluster 25: Export-Driven Transformer\n- Cluster 26: EDA-Driven Transformer\n- Cluster 27: Commented Extractor\n- Cluster 28: Export-Heavy Engineer\n- Cluster 29: Evaluation Exporter\n- Cluster 30: Visualization Specialist\n- Cluster 31: Environment-Driven Visualizer\n- Cluster 32: Transformative Explorer\n- Cluster 33: Visual Data Transformer\n- Cluster 34: Tuned Transformation\n- Cluster 35: Extraction-Driven Workflow\n- Cluster 36: Environment-Centric Workflow\n\n## Individual Cluster Summaries\n- Cluster 1: Focuses on extensive data transformation with a delayed data extraction phase, ideal for preprocessing-heavy tasks.\n- Cluster 2: Combines data extraction and transformation with frequent commenting, suitable for exploratory analysis with documentation.\n- Cluster 3: Emphasizes repeated data extraction followed by transformation, useful for datasets requiring multiple loading stages.\n- Cluster 4: Prioritizes visualization with intermittent data extraction, catering to users focused on visual data exploration.\n- Cluster 5: Centers on data transformation post-EDA, indicative of workflows refining insights from initial analysis.\n- Cluster 6: Dominated by model training interspersed with data transformation, fitting for iterative model development.\n- Cluster 7: Primarily involves data extraction with a final export, ideal for data collection and output tasks.\n- Cluster 8: Features a strong focus on data export following feature engineering, suitable for finalizing and sharing results.\n- Cluster 9: Alternates between feature engineering and model evaluation, reflecting a cycle of feature refinement and assessment.\n- Cluster 10: Uniquely consists of a single model training step, possibly representing a minimalistic training approach.\n- Cluster 11: Involves repeated environment setup with a final export, useful for environments requiring frequent resets.\n- Cluster 12: Combines data extraction with visualization, suitable for users needing to visualize large datasets.\n- Cluster 13: Integrates EDA and visualization, ideal for comprehensive data exploration and presentation.\n- Cluster 14: Focuses on data transformation with a concluding evaluation, suited for workflows refining models post-transformation.\n- Cluster 15: Consistently applies data transformation, indicative of workflows requiring extensive preprocessing.\n- Cluster 16: Mixes data transformation with commentary, fitting for documented data cleaning processes.\n- Cluster 17: Features commentary interspersed with transformation, useful for annotated preprocessing workflows.\n- Cluster 18: Combines feature engineering with model training and tuning, ideal for optimized model development.\n- Cluster 19: Involves model training with frequent commentary, suitable for documented training processes.\n- Cluster 20: Alternates between data extraction and model evaluation, reflecting a workflow focused on iterative data assessment.\n- Cluster 21: Shows a repetitive pattern of data extraction and transformation, useful for iterative preprocessing.\n- Cluster 22: Combines data transformation with visualization and commentary, fitting for documented visual analysis.\n- Cluster 23: Integrates EDA and visualization with transformation, ideal for exploratory data analysis and presentation.\n- Cluster 24: Emphasizes visualization with some transformation, suitable for visually-driven data insights.\n- Cluster 25: Focuses on data transformation with a final export, indicative of workflows preparing data for output.\n- Cluster 26: Combines data extraction with EDA, useful for exploratory data analysis with iterative data loading.\n- Cluster 27: Features repeated data extraction with commentary, fitting for documented data collection processes.\n- Cluster 28: Centers on data export following feature engineering, suitable for finalizing and sharing engineered datasets.\n- Cluster 29: Involves model evaluation with a concluding export, ideal for workflows focused on model assessment and results sharing.\n- Cluster 30: Prioritizes visualization, reflecting a workflow dedicated to visual data exploration.\n- Cluster 31: Combines environment setup with visualization, suitable for environments requiring frequent visual updates.\n- Cluster 32: Focuses on data transformation with EDA, indicative of exploratory data preprocessing.\n- Cluster 33: Integrates data transformation with visualization, ideal for workflows requiring visual data insights.\n- Cluster 34: Combines model training with hyperparameter tuning, fitting for optimized model development.\n- Cluster 35: Emphasizes data extraction, suitable for workflows focused on data collection and preparation.\n- Cluster 36: Features repeated environment setup, ideal for workflows requiring frequent environment resets."
}